{
  "kind": "chatgpt-sidecar-authority-manifest",
  "spec_version": "0.1.3",
  "sidecar_status": "temporary_shallow_sidecar",
  "workflow_authority_root": "control/scm.pattern",
  "validation_surface_root": "schemas/control/scm.pattern",
  "template_surface_root": "templates",
  "precedence": [
    "control/scm.pattern/authority.manifest.json",
    "control/scm.pattern/**",
    "schemas/control/scm.pattern/**",
    "templates/**",
    "generated/**"
  ],
  "conflict_resolution": [
    "workflow docs define lifecycle and review semantics",
    "schemas define object shape and field validity",
    "templates scaffold only",
    "generated artifacts are instances only",
    "fail closed on control or schema drift"
  ],
  "approval_basis_inputs": [
    "control/scm.pattern/authority.manifest.json",
    "control/trust/root.signers.json",
    "control/trust/delegations/chatgpt.packet-sidecar.json",
    "pipeline/chatgpt.packet.pipeline.manifest.json",
    "pipeline/chatgpt.execution.policy.json",
    "pipeline/chatgpt.validation.manifest.json",
    "pipeline/chatgpt.gate.policy.json",
    "pipeline/problem_set.schema.json",
    "schemas/chatgpt-packet/**"
  ],
  "delegated_surfaces": [
    {
      "path": "control/scm.pattern/**",
      "role": "workflow_authority",
      "status": "normative_for_lifecycle"
    },
    {
      "path": "pipeline/**",
      "role": "execution_runtime",
      "status": "normative_for_packet_authoring"
    },
    {
      "path": "schemas/chatgpt-packet/**",
      "role": "validation_surface",
      "status": "delegated_validation_only"
    },
    {
      "path": "templates/**",
      "role": "rendering_surface",
      "status": "scaffold_only"
    }
  ],
  "deprecation_note": "This authority surface remains intentionally shallow and removable. The operational packet runtime stays local and realization remains outside the ChatGPT boundary."
}
