{
  "kind": "chatgpt-sidecar-authority-manifest",
  "spec_version": "0.1.3",
  "sidecar_status": "temporary_shallow_sidecar",
  "workflow_authority_root": "control/scm.pattern",
  "validation_surface_root": "schemas/sidecar/chatgpt-packet",
  "template_surface_root": "templates",
  "precedence": [
    "control/scm.pattern/authority.manifest.json",
    "control/scm.pattern/**",
    "schemas/sidecar/chatgpt-packet/**",
    "templates/**",
    "generated/**"
  ],
  "conflict_resolution": [
    "workflow docs define lifecycle and review semantics",
    "schemas define object shape and field validity",
    "templates scaffold only",
    "generated artifacts are instances only",
    "fail closed on control or schema drift"
  ],
  "approval_basis_inputs": [
    "generated/packets/pkt-gpt-handoff-sidecar-001/machine/packet.definition.json",
    "generated/packets/pkt-gpt-handoff-sidecar-001/machine/scm.pattern.binding.json",
    "control/scm.pattern/authority.manifest.json"
  ],
  "delegated_surfaces": [
    {
      "path": "control/scm.pattern/**",
      "role": "workflow_authority",
      "status": "normative_for_lifecycle"
    },
    {
      "path": "schemas/sidecar/chatgpt-packet/**",
      "role": "validation_surface",
      "status": "delegated_validation_only"
    },
    {
      "path": "templates/**",
      "role": "rendering_surface",
      "status": "scaffold_only"
    }
  ],
  "deprecation_note": "This sidecar remains intentionally shallow and removable. Deeper normalization into kernel-core is deferred."
}
